{"contract":"autodev.benchmark-task.v1","version":"v1","task_id":"v-001","split":"validation","task_class":"SMALL_CODE_CHANGE","instruction":"In the isolated fixture, correct slugify so repeated whitespace is represented by one hyphen and verify the supplied test. Only the fixture tree may change; report the diff and test result.","input":{"bug":"multiple spaces produce multiple hyphens","expected":"hello-world"},"setup":{"type":"materialize_fixture","fixture_ref":"repos/v-001.json","network":"disabled"},"execution_mode":"fixture_mutation","allowed_tools":["read","search","test","edit"],"forbidden_actions":["modify any production repository","use the network","read secrets","write outside the fixture","access another split"],"acceptance_criteria":["slugify('Hello  World') returns hello-world.","The supplied test passes.","Only the fixture source file changes."],"verifier":{"type":"fixture_diff","required_state":"DONE","required_files":["src/slug.py"],"expected_files":{"src/slug.py":"def slugify(value):\n    return '-'.join(value.lower().split())\n"}},"timeout_seconds":240,"max_attempts":1,"mutation_policy":{"scope":"fixture_only","production_mutation":false,"allowed_paths":["src/slug.py"]},"cleanup":{"type":"destroy_temporary_fixture","required":true},"expected_failure_classes":["OUT_OF_SCOPE_MODIFICATION","BUILD_NO_CHANGES","TEST_FAILURE","TIMEOUT"],"fixture_hash":"af40aff70b1d5c08295b8d91acd21f101b909fad8a925ee50e6da01bcc3a69ce","task_hash":"4b0e22e0464fe0d464175f4017af5b38a974a4b17250d5cba90e424e9b1891ef"}
