{"contract":"autodev.benchmark-task.v1","version":"v1","task_id":"h-001","split":"holdout","task_class":"REPOSITORY_NAVIGATION","instruction":"Navigate this unseen fixture and identify the parser's key/value behavior, including the no-separator case. Return structured evidence with exact file and symbol names; do not edit.","input":{"examples":["a=1","flag"]},"setup":{"type":"materialize_fixture","fixture_ref":"repos/h-001.json","network":"disabled"},"execution_mode":"read_only","allowed_tools":["read","search"],"forbidden_actions":["edit files","use the network","read secrets","access development or validation data"],"acceptance_criteria":["Identify parse_pair in src/parse.py.","Explain both separator and no-separator behavior.","Keep the fixture unchanged."],"verifier":{"type":"repository_evidence","required_state":"DONE","required_files":["src/parse.py"],"required_symbols":["parse_pair"]},"timeout_seconds":180,"max_attempts":1,"mutation_policy":{"scope":"none","production_mutation":false,"allowed_paths":[]},"cleanup":{"type":"destroy_temporary_fixture","required":true},"expected_failure_classes":["CONTRACT_FAILURE","PROVIDER_FAILURE","TIMEOUT"],"fixture_hash":"7d8af1b92212f1b2909f285e5b26794dd388b443c0bef67a8bff27cd249657a9","task_hash":"ab18818841e8a95d063fc0d00acf2125961d4e167b8badc7ce76087b133d04e4"}
