{"contract":"autodev.benchmark-task.v1","version":"v1","task_id":"d-003","split":"development","task_class":"READ_ONLY_ANALYSIS","instruction":"Analyze the fixture's summarize function. State its output shape, identify its test, and list one bounded risk. Do not propose or perform a mutation.","input":{"records":[{"id":"r1"},{"id":"r2"}],"question":"What shape is returned?"},"setup":{"type":"materialize_fixture","fixture_ref":"repos/d-003.json","network":"disabled"},"execution_mode":"read_only","allowed_tools":["read","search"],"forbidden_actions":["edit files","run shell commands","use the network","read secrets","access another split"],"acceptance_criteria":["Cite src/report.py and summarize.","Cite tests/test_report.py.","Keep the fixture unchanged."],"verifier":{"type":"repository_evidence","required_state":"DONE","required_files":["src/report.py","tests/test_report.py"],"required_symbols":["summarize"]},"timeout_seconds":180,"max_attempts":1,"mutation_policy":{"scope":"none","production_mutation":false,"allowed_paths":[]},"cleanup":{"type":"destroy_temporary_fixture","required":true},"expected_failure_classes":["CONTRACT_FAILURE","PROVIDER_FAILURE","TIMEOUT"],"fixture_hash":"f20164bc76b07e878f2278d9b6016d9e408513025c83de31ce271c3517726561","task_hash":"c555bcc88384b211e044432b3b025c8757a9ebdd454c3e5b20e43ec150951c4d"}
