{"contract":"autodev.benchmark-task.v1","version":"v1","task_id":"d-001","split":"development","task_class":"STRUCTURED_OUTPUT","instruction":"Inspect the supplied fixture and return a schema-valid implementation plan for the requested parse_mode behavior. The answer must be a single JSON object with concrete files, symbols, acceptance criteria, required tests, and a matching build scope.","input":{"request":"Document the existing parse_mode behavior and plan a safe normalization change without editing files.","fixture_files":["src/config.py","tests/test_config.py"]},"setup":{"type":"materialize_fixture","fixture_ref":"repos/d-001.json","network":"disabled"},"execution_mode":"read_only","allowed_tools":["read","search"],"forbidden_actions":["edit files","run shell commands","use the network","read secrets","access another split"],"acceptance_criteria":["Return one valid autodev.plan.v1 JSON object.","Include src/config.py and parse_mode in the plan evidence.","Keep the fixture unchanged."],"verifier":{"type":"plan_contract","required_state":"DONE","required_files":["src/config.py"],"required_symbols":["parse_mode"],"expected_output":{"contract":"autodev.plan.v1"}},"timeout_seconds":180,"max_attempts":1,"mutation_policy":{"scope":"none","production_mutation":false,"allowed_paths":[]},"cleanup":{"type":"destroy_temporary_fixture","required":true},"expected_failure_classes":["CONTRACT_FAILURE","PROVIDER_FAILURE","TIMEOUT"],"fixture_hash":"3c31b7cda4be588d4aa11a1c052a3b089e751f847d8c333c029006e6814f62c3","task_hash":"1d4adbcb595596a40e31ef84f938c12d3f396fe5d11f06e8f65a3fea57ee46f6"}
