{"contract":"autodev.benchmark-task.v1","version":"v1","task_id":"h-002","split":"holdout","task_class":"STRUCTURED_OUTPUT","instruction":"Produce one schema-valid plan JSON object for the unseen window fixture. Include concrete targets, the relevant symbol, acceptance criteria, and matching allowed files. Do not edit the fixture.","input":{"values":[1,2,3],"size":2},"setup":{"type":"materialize_fixture","fixture_ref":"repos/h-002.json","network":"disabled"},"execution_mode":"read_only","allowed_tools":["read","search"],"forbidden_actions":["edit files","run shell commands","use the network","read secrets","access development or validation data"],"acceptance_criteria":["Return one valid autodev.plan.v1 JSON object.","Include src/window.py and window in the plan evidence.","Keep the fixture unchanged."],"verifier":{"type":"plan_contract","required_state":"DONE","required_files":["src/window.py"],"required_symbols":["window"],"expected_output":{"contract":"autodev.plan.v1"}},"timeout_seconds":180,"max_attempts":1,"mutation_policy":{"scope":"none","production_mutation":false,"allowed_paths":[]},"cleanup":{"type":"destroy_temporary_fixture","required":true},"expected_failure_classes":["CONTRACT_FAILURE","PROVIDER_FAILURE","TIMEOUT"],"fixture_hash":"3a4b9c9a8afd62cab015ebd878e68034fb7ff8579a834e427bfcf8edde5f9709","task_hash":"5513eca7e6825ab14cef3e98b3dbf1b3e5b9086807b780ac8c838cf7b5877a08"}
