{"contract":"autodev.benchmark-task.v1","version":"v1","task_id":"v-002","split":"validation","task_class":"FAILURE_RECOVERY","instruction":"Observe the controlled retry policy defect in the fixture, explain why a 429 response is not retryable under the current function, then make the smallest fixture-only correction and verify it.","input":{"failing_case":{"status":429},"expected":true},"setup":{"type":"materialize_fixture","fixture_ref":"repos/v-002.json","network":"disabled"},"execution_mode":"fixture_mutation","allowed_tools":["read","search","test","edit"],"forbidden_actions":["modify any production repository","use the network","read secrets","write outside the fixture","access another split"],"acceptance_criteria":["retryable(429) returns true.","The supplied test still passes.","Report the observed failure and the bounded correction."],"verifier":{"type":"fixture_diff","required_state":"DONE","required_files":["src/retry.py"],"expected_files":{"src/retry.py":"def retryable(status):\n    return status >= 429\n"}},"timeout_seconds":240,"max_attempts":1,"mutation_policy":{"scope":"fixture_only","production_mutation":false,"allowed_paths":["src/retry.py"]},"cleanup":{"type":"destroy_temporary_fixture","required":true},"expected_failure_classes":["OUT_OF_SCOPE_MODIFICATION","TEST_FAILURE","TIMEOUT"],"fixture_hash":"e25f25bee21032a842390ce1aa2c3f3a4df6703e1e5dadf48c4eab43b615b020","task_hash":"a7ed0f734fc8c0503801241e7f453dd64129f19cb54158a7a5cd0cd528c52204"}
