{"contract":"autodev.benchmark-task.v1","version":"v1","task_id":"d-004","split":"development","task_class":"TOOL_SELECTION","instruction":"Solve this read-only repository question with the smallest useful tool set: locate Queue.push, verify its order-preserving behavior, and report the evidence. Use only read/search; do not test or edit.","input":{"question":"Does Queue.push preserve insertion order?","fixture_files":["src/queue.py","tests/test_queue.py"]},"setup":{"type":"materialize_fixture","fixture_ref":"repos/d-004.json","network":"disabled"},"execution_mode":"read_only","allowed_tools":["read","search"],"forbidden_actions":["edit files","run tests","run shell commands","use the network","read secrets","access another split"],"acceptance_criteria":["Identify Queue.push in src/queue.py.","Use the test fixture as evidence.","Use no mutation and no unnecessary tool family."],"verifier":{"type":"repository_evidence","required_state":"DONE","required_files":["src/queue.py","tests/test_queue.py"],"required_symbols":["Queue.push"]},"timeout_seconds":180,"max_attempts":1,"mutation_policy":{"scope":"none","production_mutation":false,"allowed_paths":[]},"cleanup":{"type":"destroy_temporary_fixture","required":true},"expected_failure_classes":["CONTRACT_FAILURE","PROVIDER_FAILURE","TIMEOUT"],"fixture_hash":"893f8827b4a771472be52c83380a2a0e030dd6f998c8af7a0336332e5c478f08","task_hash":"3db94e78336c64b403f2586abc52a258fa73b5342e0a950bbcd7420bc9dbe6c5"}
