{"contract":"autodev.benchmark-task.v1","version":"v1","task_id":"d-002","split":"development","task_class":"REPOSITORY_NAVIGATION","instruction":"Navigate the fixture without modifying it. Identify the function that resolves a service name to a port and return structured evidence naming the exact file, symbol, and relevant acceptance check.","input":{"service":"adapter","expected_port":"8081"},"setup":{"type":"materialize_fixture","fixture_ref":"repos/d-002.json","network":"disabled"},"execution_mode":"read_only","allowed_tools":["read","search"],"forbidden_actions":["edit files","run tests that write artifacts","use the network","read secrets","access another split"],"acceptance_criteria":["Identify src/catalog.py and endpoint.","Explain the lookup behavior using fixture evidence.","Keep the fixture unchanged."],"verifier":{"type":"repository_evidence","required_state":"DONE","required_files":["src/catalog.py"],"required_symbols":["endpoint"]},"timeout_seconds":180,"max_attempts":1,"mutation_policy":{"scope":"none","production_mutation":false,"allowed_paths":[]},"cleanup":{"type":"destroy_temporary_fixture","required":true},"expected_failure_classes":["CONTRACT_FAILURE","PROVIDER_FAILURE","TIMEOUT"],"fixture_hash":"4097da921f264e9f9a71096513216953ab98a42a1994cd5328c9a8b45d16bc07","task_hash":"f5458ad9074044e703e7f434a214b7d180c754e9fbedc33b18ae50b6d470315c"}
